answer,question
"النفور من الطعام , الإمساك , الغثيان , التعب, ألم الثدي , كثرة التبول, تغيرات في الحالة المزاجية , تشنّجات , الانتفاخ  , بقع دم.",ماهي أعراض وعلامات الحمل في الشهر الأول ؟
"قد لا تكون المرأة حاملاً بالفعل اول أسبوعين لأنه عادة ما يتم حساب فترة الحمل من آخر دورة شهرية، ولكن وفي حال حدوث الحمل، فعادةً ما يكون الجنين صغيراً جداً في هذه المرحلة بما يعادل حجم بذور الخشخاش أي حوالي 2 مم.",ماهو تطور الجنين في الأسبوع الأول من الحمل ؟ 
"يعتمد اختصاصيي النسائية والتوليد في تحديدهم لموعد الولادة المُرتقب على احتساب اليوم الأول من الدورة الشهريّة الأخيرة على أنّه بداية الشهر الأول من الحمل، يُضَاف له 40 أسبوعًا ليكون الناتج هو يوم الولادة؛ ما يعني بأنّ الأسبوع الأول لا يتضمَّن حدوث الحمل! إنمّا يلجأ الاختصاصيين لهذه الطريقة نظرًا لصعوبة تحديد التوقيت الدقيق لحدوث الإخصاب بين البويضة والحيوان المنوي.",ما الذي يحدث في الأسبوع الأول ؟
"كما في الأسبوع الأول من الحمل، فإنّ الأسبوع الثاني لا يتضمّن تكوُّن الجنين أيضًا، إنمّا تحدث الإباضة خلال هذا الأسبوع بخروج البويضة من الحويصلة في المبيض. يبدأ خلال الأسبوع الثاني إفراز العديد من الهرمونات لتوكيد خروج البويضة من الحويصلة التي تحويها وتحفيز تحركُّها نحو قناة فالوب، حيث تبقى 24 ساعة تقريبًا بانتظار تخصيبها مع الحيوان المنوي. أهّم الهرمونات التي ترتفع مستوياتها خلال مرحلة الإباضة في الأسبوع الثاني: الإستروجين، الهرمون المحفّز للجُريب (FSH) والهرمون المُلوتِن (LH). غالبًا ما يحدث الحمل في نهاية الأسبوع الثاني من الحمل، حتى الآن يُحتسَب كل من الأسبوع الأول والثاني من فترة الحمل على الرغم من عدم حدوثه بعد!",ما الذي يحدث في الأسبوع الثاني ؟
"مع بداية الأسبوع الثالث يكون الحمل قد حدث -غالبًا- باختراق أحد الحيوانات المنويّة للبويضة الموجودة في قناة فالوب، بمجرد حدوث ذلك يتغيّر تركيب البويضة فتمنع دخول أيّ حيوانٍ منوي آخر. تبدأ مجموعة من الانقسامات السريعة في البويضة المُخصّبة، وتتحرّك باتجاه الرحم استعدادًا لبدء مراحل تكوُّن الجنين بعد انغراسها بداخله.",ما الذي يحدث في الأسبوع الثالث ؟ 
"خلال هذا الأسبوع قد تشعر المرأة بأُولى علامات الحمل، فمن المفترض أن يشير تأخُّر دورتها الشهريّة المرتقبة هذا الشهر إلى حدوث الحمل، إذ إنّ انغراس البويضة المخصبّة في الرحم سيحفّز إفراز هرمون موجّهة الغدد التناسليّة المشيميّة البشريّة HCG الذي يتولّى مهمّة إيقاف إطلاق البويضات من المبايض، بالتالي غياب الدورة الشهريّة لــِ 9 أشهر قادمة.",ما الذي يحدث في الأسبوع الرابع ؟
"المواظبة على شرب كميّة كافية من السوائل , الالتزام بتناول حمض الفوليك طِيلة فترة الحمل , تناول الأطعمة الغنيّة بالكالسيوم وعدم إهمالها, علاج المشاكل التناسليّة لدى الأُم والتي قد تؤثِّر على الجنين، مثل الهربس التناسلي والكلاميديا وغيرها من الأمراض والمشاكل ذات الصِلة , الإقلاع عن التدخين وتجنُّب ""التدخين السلبي"", تناول الأطعمة الغنيّة بالحديد وفيتامين C , تجنُّب التماس المباشر بين فروة الرأس والمواد الكيميائيّة المُستخدَمة إمّا لصبغ الشعر أو غير ذلك.","ما النصائح للحامل في الشهر الأول ؟
"
"في الأسبوع الأول من الحمل، تتشابه الأعراض التي تعاني منها المرأة إلى حد كبير مع أعراض الدورة الشهرية، ويمكن أن تشمل ما يلي:

النزيف المهبلي.
آلام أسفل الظهر.
تشنجات، وغازات.
تقلب المزاج.
كما أن العديد من النساء يعانين من الصداع النصفي الطمثي والمتصل بتغير الهرمونات، ويمكن خلال هذا الأسبوع أن تؤدي الزيادة في البروجسترون إلى الشعور بآلام في الثدي.",ما اعراض الأسبوع الأول من الحمل ؟
"في هذه الفترة، تكون مستويات الهرمونات عالية بما فيه الكفاية بحيث أنها تتسبب بظهور بعض أعراض الحمل الملحوظة، ولكن بعض النساء لا يلاحظن أي أعراض قبل الأسبوع الرابع وهو أمر طبيعي. ومن هذه الأعراض التي يمكن ملاحظتها:

نزيف بسيط بعد حوالي 5 إلى 10 أيام من الحمل بسبب زرع الجنين في جدار الرحم.
كثرة التبول.
آلام الثدي، أو تغير لون الحلمة للون أغمق.
الإعياء والإرهاق.
الغثيان الصباحي.
الغازات.",ما اعراض الأسبوع الثاني من الحمل ؟
"ويكون تطور الجنين في الأسبوع الثاني كما في الأسبوع الأول، حيث لازال بحجم صغيرة جداً مثل بذور الخشخاش.
",ماهو تطور الجنين في الأسبوع الثاني من الحمل ؟ 
"نزيف بسيط بسبب زرع الجنين في جدار الرحم.
الغثيان.
تغييرات الثدي تستمر خلال هذا الأسبوع.",ما اعراض الأسبوع الثالث من الحمل ؟
"قد لا تكشف الموجات فوق الصوتية حملاً خلال هذه الفترة، لأن البويضة المخصبة أصغر من حبة الملح، ولكن من الممكن ملاحظة زيادة في حجم بطانة الرحم خلال هذه الفترة مع استمرار أعراض الأسبوع الثاني من الحمل، ومن الممكن خلال هذه الفترة تأكيد الحمل من خلال فحص الدم.",ماهو تطور الجنين في الأسبوع الثالث من الحمل ؟
"الغازات والتشنجات.
يمكن خلال هذه الفترة حدوث نزيف بسيط ولا داعي للقلق، لكن إذا كانت كمية الدم كبيرة، أو دم النزيف أكثر من يومين يجب مراجعة الطبيب.
قد تصاب المرأة بتقلب في المزاج بسبب تغير الهرمونات والغثيان الصباحي، غالبًا ما يكون في أوجه في الأسابيع التسعة الأولى وعادةً ما يختفي تماماً بعد ذلك.",ما اعراض الأسبوع الرابع من الحمل ؟ 
"البويضة المخصبة الآن هي عبارة عن كرة مكونة من 32 خلية بحجم بذرة الخشخاش، ويمكن تأكيد الحمل بشكل أفضل خلال هذا الشهر.",ماهو تطور الجنين في الأسبوع الرابع من الحمل ؟
"حمض الفوليك: هذا الحمض موجود بشكل طبيعي في الخضروات الورقية، والفواكه، والفاصولياء، ومنتجات الحبوب الكاملة، كما يجب على الأم تناول مكملات حمض الفوليك أيضاً، الذي يساهم في في تكوين الجهاز العصبي لطفلك، ويقلل من خطر الإصابة بانشقاق العمود الفقري. فيتامين د: عادةً ما يوصي الطبيب بأخذ 10 ميكروغرام من فيتامين د كل يوم طوال فترة الحمل وأيضاً خلال فترة الرضاعة.
ينصح أن تحصل المرأة على 1000 ملغ (أي ما يعادل 3 أكواب من الحليب) من الكالسيوم يومياً، ويمكن الحصول على الكالسيوم من مصادر طبيعية مثل اللبن، والسلمون، والسردين.
من المهم التقليل من استهلاك الكافيين، حيث أنه يقلل من قدرة الجسم على امتصاص الحديد والكالسيوم.
ينصح أيضاً تجب المحليات الاصطناعية.
يجب التوقف تماماً عن التدخين وشرب الكحول أثناء الحمل.",ما تغذية الأم في الشهر الأول من الحمل ؟
"من غير المحتمل أن تقوم المرأة بتصوير الأمواج فوق الصوتية للحمل خلال الأسابيع الأولى، لكن يجب عمل فحص الأمراض المنقولة جنسياً حيث أنه من الممكن أن تؤثر العدوى المنقولة جنسياً مثل الكلاميديا، ​​والسيلان، والزهري والهربس التناسلي على صحة طفلك. في الأسبوع الثالث من الحمل، يمكن للأم أن تقوم بفحص الحمل عن طريق الدم لتتأكد أنها حامل.

وبشكل عام، يجب على الأم خلال هذه الفترة مراجعة الطبيب النسائي للقيام بهذه الفحوصات قبل نهاية الثلث الأول من الحمل، وتشمل:

الفحص القفوي (بالإنجليزية: Nuchal Translucency) الذي يجرى عن طريق الأشعة الفوق صوتية، يستخدم الفحص اختبار الموجات الفوق الصوتية لفحص زيادة السوائل، أو السماكة في الجزء الخلفي من عنق الرحم.
فحص بروتينات البلازما المرتبطة بالحمل  (بالإنجليزية: Pregnancy associated plasma protein A ) الذي يجرى عن طريق الدم.
فحص الهرمون التناسلي المشيمي (بالإنجليزية: Human Chorionic Gonadotropin )، هذه الهرمونات تنتجها المشيمة في المراحل المبكرة من الحمل، ولكن ترتبط المستويات غير الطبيعية منها بزيادة خطر إصابة الجنين بخلل في الكروموسومات.

",ما هي فحوصات الشهر الأول من الحمل ؟
"نعم، تختلف اعراض الحمل حسب اشهر الحمل بشكل كبير على صعيد الأعراض الجسدية والأعراض النفسية،  فقد تكون الأشهر الأولى أكثر صعوبة على الأم من الأشهر الأخيرة، خاصة حين يتعلق الأمر بالتقيؤ والغثيان، بينما تشعر الأخريات بصعوبة الشهور الأخيرة عندما يتعلق الأمر بالحالة النفسية. فيما يلي ذكر لمعظم اعراض الحمل حسب اشهر الحمل، وكل شهر على حدى.",هل تختلف اعراض الحمل حسب اشهر الحمل؟
"الأعراض النفسية
قد تشمل اعراض الحمل في الشهر الاول عدداً من التغيرات والأعراض النفسية كذلك، ومنها:

الشعور بعدم الاتزان.
التقلبات المزاجية.
قلة الصبر.
التوتر والحيرة.
القلق.
اضطراب المشاعر، فمن اعراض الحمل في الشهر الاول أنه قد تشعر الحامل بالخوف أحياناً، والفرح والروح المعنوية العالية أحياناً أخرى.",ماهي الأعراض النفسية بالشهر الأول ؟
"قد لا تختلف اعراض الحمل النفسية في الشهر الثاني عن اعراض الشهر الاول، ومن هذه الأعراض:

الشعور بعدم الاتزان.
تغيرات مزاجية سريعة والتي تعكس الصحة العامة للحامل، وتغير هرموناتها.
قلة الصبر.
الحيرة والقلق.
اضطراب المشاعر.
الإحساس بالشبع عند الحامل.",ماهي الأعراض النفسية بالشهر الثاني ؟
"غثيان الحمل، مع التقيؤ أو دونه.
زيادة في إفرازات اللعاب.
كثرة التبول.
التعب العام.
ازدياد الشعور بالنعاس.
الإمساك.
حرقة المعدة.
صعوبة في الهضم.
انتفاخ البطن، والذي يسبب الشعور بالامتلاء عند الحامل.
النفور من الطعام، أو الشراهة تجاه نوع معين من الأطعمة.
الدوار، وأحياناً الإغماء.
الصداع، بسبب تغير الهرمونات.
ازدياد حجم الخصر والصدر.
امتلاء وثقل، أو ليونة في الثدي، حيث يميل لون حلمة الثدي إلى اللون البني.
ظهور أوردة واضحة تحت جلد الثدي.
",ماهي اعراض الحمل في الشهر الثاني ؟
"منذ بداية التخطيط للحمل، يوصى بزيارة الطبيب النسائي للتحضير لذلك والحصول على المعلومات اللازمة، ويتم التحضير للحمل من خلال ما ياتي:

1. إجراء مجموعة من الفحوصات
وتشمل ما ياتي:
فحص البول العام.
اختبارات الدم الاساسية، بما في ذلك الاختبارات الجينية، وتعداد الدم.
فحص الموجات فوق الصوتية.
اختبار الاجسام المضادة للحصبة الالمانية.
فحوصات تشخيصية لبعض الامراض، مثل: التهاب الكبد ب، والزهري، والهربس.
اختبارات للكشف عن الفيروسات المختلفة.
فحص السكر.
فحص داء المقوسات.
2. تناول اللقاحات اللازمة
إذا لزم الامر يجب تلقي بعض اللقاحات إذا كنت مصابة بامراض سابقة، مثل: السكري، وامراض القلب، وامراض الكلى وغيرها.

يجب ايضًا استشارة الطبيب المختص إذا كنت تتناولين الادوية بسبب احد هذه الامراض والتي قد تضر بالحمل، حيث يقوم الطبيب بتغييرها واستبدالها إذا كان ذلك ممكنا.",كيف يتم التحضير للحمل ؟
"النظام الغذائي السليم مع ضرورة الإكثار من شرب السوائل، ومنتجات الالبان، والخضروات الخضراء.
الامتناع عن التدخين، وتناول الكحول والمخدرات.
تقليل استهلاك الكافيين قدر الإمكان.
الاستمرار في تناول حمض الفوليك والحديد.
تناول مكملات الكالسيوم، إذ انها مهمة في عملية بناء عظام سليمة لدى الجنين.
",ماهو غذاء الحامل في الأسبوع الثالث من الحمل ؟
"هنالك فحوصات عامة تجرى للتاكد من سلامة الحامل وسلامة تطور الجنين، كما ياتي:

تحليل الدم.
فحص الوزن.
ضغط الدم.
فحوصات البول.
فحص السكر خلال الصوم.",ماهي فحوصات الحمل في الاسبوع الثالث ؟
"الشعور بالامتلاء في اسفل البطن والحوض.
الشعور بالاحتقان العام في الجسم دون حدوث زيادة في الوزن.
تغيرات في المزاج.
التعب العام.
غثيان الحمل.
حاجة ملحة ومتكررة للتبول.
",ما يحدث نهاية الاسبوع الرابع من الحمل ؟
"يعد الاسبوع الرابع من الحمل الوقت المناسب للتاكد من الحمل؛ ويتم من خلال إجراء العديد من الفحوصات كما ياتي:

فحص الحمل المنزلي
حيث يوصى بشراء اختبار الحمل المنزلي لمعرفة الجواب الاكيد، ويعد هذا الفحص طريقة سهلة وسريعة للحصول على النتيجة.

اختبار الدم
يعد هذا الاختبار اكثر موثوقية، إذ فحص وجود هرمون الحمل وكميته في الدم، ويمكن لهذا النوع من الفحوصات ان يكشف عن الحمل قبل ثلاثة ايام من موعد الحيض.

اختبار الموجات فوق الصوتية
لا يعد اختبار الموجات الصوتية فعالًا في الكشف عن الحمل في هذه المرحلة، ولكن يمكن اللجوء إليه في الاسبوع الخامس من الحمل، حيث تنمو انسجة الحمل ويمكن عندها البدء برؤية كيس الحمل.",ماهي فحوصات الحمل في الأسبوع الرابع ؟
"يعتبر الشهر الثاني من الحمل من الشهور الحاسمة لأنه يطمئن الأم على سلامة الجنين واستمرارية الحمل، وكثير من النساء لا يدركن حدوث الحمل إلى خلال الشهر الثاني من الحمل، حيث يتأكد انقطاع الدورة الشهرية وتشعر المرأة بمجموعة من الأعراض المشابهة لأعراض الدورة.",ما هو الشهر الثاني من الحمل ؟ 
"كثير من النساء لا يعلموا بوجود حمل خلال الشهر الأول من الحمل، حيث لا تزال الأعراض بسيطة أو معدومة، كما يصعب التأكد من توقف الدورة الشهرية خلال الفترة الأولى من هذا الشهر حتى يأتي موعدها وتكتشف المرأة أنها حامل.
معظم الأطباء يقومون بحساب فترة الحمل بدءاً من اليوم الأول من آخر دورة شهرية، وذلك لأن وقت الإباضة والحمل يصعب تحديدهما بشكل دقيق و تعد هذه الطريقة دقيقة إلى حد ما.",ما هو الشهر الأول من الحمل ؟
"هو الأسبوع الأول من الشهر الثاني للحمل، وهو بالعادة الوقت الذي تلاحظ فيه الأم أنها حامل، وهي الفترة التي يمكن فيها قياس حجم الطفل حيث يكون تقريباً حجمه كحجم بذرة التفاح أي ما يعادل 3.3 ملم.
تشمل تطورات الجنين في الأسبوع الخامس من الحمل ما يلي:

بدء تكون الأعضاء الرئيسية مثل القلب، والمعدة، والكبد، والكلى.
بدء تطور الجهاز الهضمي، والجهاز العصبي.",ماهو تطور الجنين في الأسبوع الخامس من الحمل ؟
"في الأسبوع السادس من الحمل، يكون حجم الطفل مثل حجم حبة البازلاء (أي ما يعادل 6.4 ملم).

وفي هذا الأسبوع، تكون التطورات كالتالي:

تتطور الدورة الدموية للطفل.
قد يكون الطفل قادراَ على تحريك أيديه وأرجله على شكل ما يشبه تجديف.
بدء تكون الأنف، والعينين، والأذنين، والذقن والخدين عند الطفل.
خلال فحص الموجات فوق الصوتية، قد يستطيع الطبيب سماع نبض قلب الجنين، وهي علامة واضحة على تطور الطفل.",ماهو تطور الجنين في الأسبوع السادس من الحمل ؟
"في هذا الأسبوع، يكون حجم الطفل بحجم حبة التوت البري (أي ما يعادل 13 ملم).
تتمثل تطورات الجنين خلال الأسبوع السابع من الحمل في:

ينمو للجنين حوالي مئة خلية دماغية جديدة كل دقيقة.
نمو وتطور القلب أيضاً بشكل كبير.
تطور الكلى.
تشكل المفاصل واليدين والساقين.",ماهو تطور الجنين في الأسبوع السابع من الحمل ؟
"في هذا الأسبوع، يكون حجم الطفل ما يقارب حجم حبة التوت (أي ما يعادل 1.6 سم).

وتكون تطورات الجنين في هذا الأسبوع كالتالي:

يمكن أن يقوم الجنين بتحريك ساقيه و يظهر ذلك أحياناً خلال فحص الموجات الفوق صوتية.
تكون أصابع قدمي الطفل.
اختفاء الجزء الصغير في نهاية ظهره والذي يشبه الذيل.
تشكل براعم التذوق لدى الطفل، وبإمكانه الآن تذوق الطعام الذي يصله عن طريق والدته.",ماهو تطور الجنين في الأسبوع الثامن من الحمل ؟
"الزنك: يعتبر الزنك أحد العناصر الهامة للمرأة الحامل، وذلك لأنه يساعد على القيام بكافة العمليات الحيوية، وهناك العديد من الأطعمة الغنية بالزنك مثل الدجاج والسمك والخضروات والفاصوليا.
الكالسيوم: أيضاً يعتبر الكالسيوم معدن أساسي خلال الشهر الثاني، ويجب تناول 1000 ملغ من الكالسيوم يومياً.
البروتينات: البروتين ضروري من بداية الحمل، حيث يعتبر الدجاج، والبيض، والحليب، والأسماك والعدس كلها أطعمة غنية بالبروتين، وهناك حاجة لما لا يقل عن 75 غرام من البروتين للأم الحامل.
",ما تغذية الحامل في الشهر الثاني ؟
"البيض غير المطبوخ ,اللحوم المعلبة والمعالجة , الحليب غير المبستر, الأسماك غير المطهوة.","ما الأطعمة التي ينصح بتجنبها خلال الشهر الثاني من الحمل ؟
"
"الأسماك التي تحتوي على نسبة مرتفعة من الزئبق مثل سمك القرش، الماكريل، التونة، سمك القرميد وغيرها. حيث أن الزئبق يؤثر سلبًا على الجنين.
اللحوم، والأسماك النيئة أو غير المطبوخة جيداً، للوقاية من العدوى فيروسية، أو البكتيرية، أو الطفيلية.
البيض النيئ الذي قد يسبب عدوى السالمونيلا.
اللحوم العضوية، حيث تحتوي على نسبة مرتفعة من فيتامين أ الذي يرتبط بالتشوهات الخلقية وخطر الإجهاض.
كبدة الحيوانات أو أي أطعمة تحتوي نسبة عالية من فيتامين أ.
الأطعمة والمشروبات التي تحتوي على الكافيين.
الخضروات والفاكهة غير المغسولة جيداً.
الحليب غير المبستر، حيث يحتوي على مجموعة من البكتيريا الضارة التي تهدد حياة الجنين، أو الأطعمة المصنوعة من الحليب غير المبستر ، مثل جبن الماعز الطري.
المكملات الغذائية التي تحتوي على فيتامين أ أو زيت كبد السمك.
مشروبات الطاقة.",ما الأطعمة التي ينصح بتجنبها خلال الشهر الأول من الحمل ؟
"تكون التغيرات في شكل الجنين في الاسبوع الخامس تغيرات طفيفة نسبيًا، وتشمل ما ياتي:

يكون حجم الجنين في الاسبوع الخامس هو 0.3 سنتيمتر.
يحدث نمو كبير للراس بالمقارنة مع الاجزاء الاخرى من الجنين، كما يحدث نمو سريع للدماغ والوجه.
تظهر براعم الاطراف في الجنين، حيث تكون الاطراف السفلية على شكل زعانف بينما تكون العلوية اشبه بالمجذاف.
يتم إجراء اختبار الموجات فوق الصوتية خلال الاسبوع الخامس، والذي يظهر ما إذا كنت سوف تلدين توامًا.",ما شكل الجنين في الأسبوع الخامس من الحمل ؟
