answer,question
"من غير المحتمل الشعور بوجود حركات الجنين في الأسبوع السادس عشر من الحمل، ولكن هذا لا يعني أنك لن تشعرين ببعض الحركات الخفيفة التي تبدو مثل التقلصات خاصة وإن لم تكن هذه هي أول تجربة حمل لديك.

ستكون المشيمة بمثابة وسادة تستوعب الكثير من حركات الطفل ما عدا الحركات القوية، وغالباً ما تشعر النساء اللواتي يمتلكن مشيمة على الجدار الأمامي من الرحم بالقرب من الجلد بالحركات في مرحلة متأخرة أكثر من النساء اللواتي يمتلكن مشيمة أقرب إلى الجزء الخلفي من الظهر.
","ماسبب تقلصات الأسبوع السادس عشر من الحمل؟
"
"يختلف شكل البطن وحجمه من أم لأخرى، فقد يكون بروز بطنك مرئياً بوضوح خلال الأسبوع السادس عشر من الحمل، وسوف تدهشين من سرعة نموه، كما قد ترغبين بالتسوق لشراء ملابس فضفاضة أكثر لإخفائه.
","ماهو شكل البطن في الأسبوع السادس عشر من الحمل؟

"
"من أهم الفحوصات تحليل البول، وقياس ضغط الدم، ومعدل ضربات قلب الجنين، واختبار تحمل الجلوكوز لمدة ساعة، والفحوصات التي يمكنها الكشف عن أي تشوهات كروموسومية ووراثية للجنين.
","ماهو أهم فحص في الأسبوع السادس عشر من الحمل؟
"
"من الممتع متابعة تطور الجنين في الاسبوع السادس عشر من الحمل، ولأول مرة منذ بداية الحمل يكون جسم طفلك أطول من رأسه، وسيستمر تطوره في هذا الأسبوع مثل:

الدماغ: تبدأ الخلايا العصبية التي تشكل المادة الرمادية الخارجية بالتمركز داخل الدماغ، وتحتاج للانتقال خارجاً إلى موقعها النهائي، وتحدث هذه العملية في موجات تستغرق 8-16 أسبوع، ولا تكتمل عملية الترحيل حتى الوصول للأسبوع 25 كما لا يمكن اكتشاف النشاط الكهربائي حتى الأسبوع 29.
الجلد: سيبقى جلد طفلك شبه شفاف، وسيبدأ بتطوير بصيلات الشعر مع مرور الوقت.
الأطراف العلوية: تتطور الأطراف العلوية بشكل جيد، وبمعدل أسرع من الأطراف السفلية التي تستمر بالتطور والنمو إلى ما بعد الولادة.
الرئتين: يجب أن يكون الصدر ممتلئاً تماماً بالسائل الأمنيوسي؛ كي تتمكن الرئتين من التوسع والتطور استعداداً للتنفس، حيث تستمر الرئتين بالانقسام.
",ماذا تطور في جنيني خلال الأسبوع السادس عشر؟
"عادة ما يكون متوسط طول الجنين من أعلى رأسه إلى كعبه حوالي 18 سم، بينما يبلغ وزنه حوالي 144 جراماً.
",ماحجم الجنين في الاسبوع السادس عشر؟
"أكثري من تناول الشوربات بكافة أنواعها بما فيها شوربة الخضار، أو اللحم والدجاج، فهي تمد الحامل بالسوائل، والألياف، والبروتين.

إن كنتي معتادة على ممارسة التمارين الرياضية، فاحرصي أن تتناولي 100- 200 سعرة حرارية زيادة على غذائك المعتاد، واختاري أطعمة صحية.
",ماذا اتناول في الأسبوع السادس عشر من الجمل؟
"احرصي على تجنب الأنشطة التي تتطلب جهداً مكثفاً، وتلك التي تنطوي على مخاطر عالية كركوب الخيل، والتزلج، أنا فيما يخص الغوص فينصح باستشارة الطبيب.

تنصح الحامل باستخدام جهاز ترطيب الجو، أو المحاليل الملحية إن كانت تعاني من احتقان في الأنف أو نزيف ناتج عن زيادة حجم الأغشية المخاطية بسبب التغيرات الهرمونية.
",محاذير الأسبوع الحادي عشر من الحمل؟
يبدأ الشهر الرابع من الحمل بحلول الأسبوع الرابع عشَر مرورًا بالأسابيع التي تليها حتى الأسبوع السادس عشر (14-16),متى. يبدأ الشهر الرابع من الحمل؟
"تبدأ معالم الوجه بالتكون. بصمات طفلك الفريدة تكونت. يبدأ الجنين بالاستجابة للمؤثرات الخارجية. يغطي جسم الجنين شعر ناعم رقيق، ويبدأ نمو الحواجب والشعر في منتصف هذا الشهر.",ماذا يفعل الجنين في بطن امه في الشهر الرابع؟
"تختلف قدرة الأم على الشعور بحركة جنينها بحسب حركة الطفل وطبيعة جسد الأم وعدد الأحمال السابقة، فعلى الرغم من أن الجنين يبدأ بالحركة بين الأسبوع الثامن والأسبوع الثاني عشر من الحمل، إلا أن الأم قد تبدأ بالشعور بحركة الجنين بين الأسبوع 16-25 من الحمل، أي في الشهر الثالث وثلاث أسابيع إلى الشهر الخامس وأسبوعين من الحمل.",متى تشعر الحامل بحركة الجنين؟
"يمثّل الشهر الرابع من الحمل مرحلة بدء اختفاء الأعراض المزعجة تدريجيًا، أبرزها الغثيان، لكن قد تعاني الحامل من حرَقة المعدة والإمساك وبعض الأعراض المزعجة الأُخرى، أمّا الجنين فأبرز ما يُميّزه هو بدء اكتمال أعضاؤه التناسلية ليمكن تمييز جنسه ذكرًا كان أم أنثى بحلول الشهر الرابع.",هل طبيعي الشعور بالغثيان في الشهر الرابع؟
"لا يمكن الإجابة عن سؤال متى يبدأ الوحم بإجابة محددة حيث أنه يبدأ في أوقات مختلفة بين امرأة وأخرى، لكن يبدأ عادة في الثلث الأول من الحمل، أي في الشهور الثلاثة الأولى، وقد يبدأ في وقت أبكر عند البعض في الأسبوع الخامس من الحمل.",متى يبدأ الوحم؟
"كثرة التبول عند الحامل بسبب التغيرات الهرمونية
التغير في مستويات الهرمونات في جسم الأم الحامل يؤدي إلى التبول المتكرر، وخاصة في الثلثين الأول والثالث من الحمل.",متى يبدا كثرة التبول في الحمل؟
"
تتغير الهرمونات خلال شهور الحمل، ويصبح جسم المرأة أكثر دفئا بسبب زيادة الهرمونات، يؤدي ذلك إلى التعرق مما يسبب رائحة سيئة للجسم. في نفس الوقت، يزداد تدفق الدم لحمل الأكسجين والتغذية للجنين، مما يؤدي إلى زيادة حرارة الجسم ومن ثم زيادة التعرق وظهور الرائحة.",ما سبب رائحة الجسم الكريهة للحامل؟
"
خلال الثلث الثالث من الحمل، تعاني الكثيرات من مشكلات النوم، مما يؤدي إلى تقلبات مزاجية.",متى يبدأ تقلب المزاج للحامل؟
"
الحمل والأسابيع أو الأشهر الأولية هي وقت لتغيير نفسي كبير لكلا الوالدين. مثل هذه التغييرات النفسية أثناء الحمل تساعد في التحضير والتكيف للأبوة، والهوية الذاتية، والعلاقة الزوجية وعلاقة الوالدين والرضع. علاوة على ذلك، فإن الحالة النفسية للمرأة الحامل ديناميكية وتتغير / تتقلب خلال كل ثلاثة أشهر.",هل المرأة الحامل تتغير نفسيتها؟
"
تبدأ حالات الكآبة النفاسية خلال يومين أو ثلاثة بعد الولادة، وقد تستمر لمدة أسبوعين",الى متى يستمر اكتئاب الحمل؟
"
ويزيد التعرض لاكتئاب حاد أثناء فترة الحمل من خطر الولادة المبكرة وانخفاض وزن المولود وانخفاض نمو الجنين ومشكلات أخرى للطفل. كما يزيد الاكتئاب غير المستقر أثناء فترة الحمل أيضًا من خطر الإصابة باكتئاب ما بعد الولادة ومواجهة صعوبة في الارتباط بطفلكِ.",هل الاكتئاب اثناء الحمل يؤثر على الجنين؟
"
والسؤال هنا هل العصبية من علامات الحمل بولد؟ الحقيقة: إن تقلب مستويات الهرمونات أثناء الحمل هو أمر طبيعي ويحدث عند الحمل بكلا الجنسين. لذا لا يوجد علاقة بين تقلب المزاج وجنس الجنين.",هل العصبية تدل على نوع الجنين؟
"
تمر الحامل لتغيرات هرمونية كثيرة خلال فترة الحمل، خاصة في الأشهر الأخيرة التي يستعد فيها الجسم لعملية الولادة، مما يؤثر على الحالة النفسية للحامل. حيث ترتفع نسبة هرمون البورلاكتين المسئول عن إفراز الحليب للرضيع، كما ترتفع هرمونات البروجسترون والاستروجين وهي تسبب الشعور بالعصبية والاكتئاب والحزن والقلق والتوتر.",هل يوجد هرمون في الحمل يسبب اكتئاب؟
"
التغيرات الهرمونية في الجسم، حيث أن هرمون البروجيستيرون يرتفع خلال الثلث الأول من الحمل، مسبباً اضطرابات في النوم للحامل. الحاجة للتبول بشكل متكرر، والناتج عن ضغط الرحم على المثانة. الغثيان أو القيء. وجود ألم في الظهر أو في الثدي.",لماذا الحامل لا تستطيع النوم؟
"
يؤثر تقلّب هرمون الحمل أيضا على حاسة الشمّ بشكل كبير، حيث يصبح لدى النساء الحوامل إحساس قوي بالروائح مثل العطور والأطعمة، أو فرط في حاسة الشم، أو نفور من روائح الطعام مثل الثوم والبصل واللحوم، ولا سيما خلال الأشهر الثلاثة الأولى من الحمل.",لماذا المرأة الحامل تكره العطور؟
"يساهم تناول السكريات أثناء الحمل في الحفاظ على الطاقة، واستقرار مستوى السكر في الدم، مما يعني زيادة الوزن بشكل صحي معتدل.",على ماذا يدل اكل الحلوى للحامل؟
"
الاجابة لاتزال في موضع بحث ودراسة، ولكن العلماء توصلوا أن الجنين قادرًا على استنشاق روائح محددة أثناء فترة وجوده في الرحم وهي : يتأثر بروائح الطعام الذي تتناوله الأم وتنتقل نكهته إلى السائل الأمينوسي و يستنشقها الجنين. يتأثر بروائح العطور و الكريمات التي قد تستعملها الأم وتنتقل للجنين عن طريق السائل الأمينوسي.",هل رائحة العطور تؤثر على الحامل؟
"
لا يوجد دراسات واضحة حول تأثير الصبغة على الحامل أو الجنين. قد يتم امتصاص جزء بسيط من المواد الكيميائية الموجودة في الصبغة لذا ينصح باجتناب الصبغة في الأشهر الثلاثة الأولى من الحمل. كما ينصح بتجنب استخدام الصبغات الخالية من مادة الأمونيا خلال فترة الحمل.",هل تؤثر رائحة صبغ الشعر على الحامل؟
"إن الكبدة ليست ممنوعة عن الحوامل ولا ضرر منها، بل بالعكس فهي تحتوي على نسبة عالية من الحديد الهام جدًّا خاصة في الأشهر الأولى للحمل",هل أكل الكبدة خطر على الجنين؟
اذا لم يكن هناك اي اعراض اخرى او افرازات من السرة لا داعي للقلق فالامر طبيعي,حامل في الشهر الخامس ولدي الم في السره هل ذا طبيعي في الحمل؟
"مع انتهاء الشهر الخامس يصبح طول الجنين حوالي 25 سم، ووزنه بين ربع كيلو غرام إلى نصف كيلو غرام.","كم وزن الجنين في الشهر الخامس؟

"
"تطرأ بعض التغيرات على حركة الطفل داخل بطن الأم مع نهاية الشهر الخامس، إذ تشعر بالرفسات الأولى للجنين والتي يطلق عليها الارتكاض؛ وهي حركة تشبه الرفرفة.",كيف تكون حركة الجنين في الشهر الخامس؟
"قد يطلب الطبيب بعض الفحوصات خلال الشهر الخامس للحمل، ومن أهمها فحص الموجات فوق الصوتية (الالتراساوند) الذي يجرى عادة بين الأسبوع 18 و 21 من الحمل، ويطمئن الطبيب خلاله على نمو الجنين وتطوره. يمكن كذلك تحديد جنس الجنين في حال كان تموضعه مناسباً داخل الرحم.",ماهي الفحوصات اثناء الشهر الخامس من الحمل؟
"قد تمر الحامل ببعض الأعراض في الشهر الخامس، مثل:

حرقة المعدة.
دوخة.
ضيق التنفس.
نزيف من اللثة والأنف.
زيادة في الشهية.
إعياء عام.
كثرة النسيان.",ماهي اعراض الشهر الخامس من الحمل؟
"
آلام في الظهر بسبب زيادة وزن الجنين والضغط الناتج على الظهر.
زيادة في الوزن تتراوح من 5 الى 15 باوند ( 2- 7 كغ).
ازدياد حجم الصدر بمقدار مقاس إلى مقاسين.",ماهي التغييرات التي تحدث للأم في الشهر الخامس؟
"يصل طول الجنين من رأسه الى ردفيه (الطول التاجي المقعدي) حوالي 13 سم.
يصبح للجنين بصمة أصابع فريدة ومكتملة النمو.
يبدأ شعر رأس الجنين بالنمو.
تستمر حاسة السمع لدى الجنين بالتطور.
يستمر الهيكل العظمي باكتساب هيئة صلبة بدلاً من الهيئة المطاطية له.
تصبح المشيمة أقوى وأكثر كثافة.",ماهي التغيرات التي تحدث في الأسبوع السابع عشر للجنين؟
"يصل طول الجنين من رأسه الى ردفيه ( الطول التاجي المقعدي) حوالي 14 سم.
تصبح إذنا الجنين في موضعهما النهائي والمكتمل.
تتكون الرموش و براعم الأسنان.
يبدأ تكون الرحم والمبايض لدى الجنين الأنثوي.",ماهي التغيرات التي تحدث في الأسبوع الثامن عشر للجنين؟
"يبدأ تكون مناطق الدماغ المتخصصة والمسؤولة عن حاسة الشم، والتذوق، والسمع، والرؤية.
يكتسب الجنين تناسب بين الأطراف وباقي الجسم.",ماهي التغيرات التي تحدث في الأسبوع التاسع عشر للجنين؟
"بعض التغييرات تحدث في الأسبوع العشرين من الحمل وتهدف لحماية الجنين من التعرض المستمر للسائل الامنيوسي، وهي:
نمو شعر خفيف يشبه الزغب على مناطق مختلفة من الجسم مثل الأكتاف والظهر، لكن يختفي هذا الشعر تلقائياً بعد الأسبوع الأول من الولادة.
تغطي الجلد مادة بيضاء شمعية شبيهة بالكريمة تسمى الطلاء الجبني (vernix caseosa)، وتبقى حتى الولادة.",ماهي التغيرات التي تحدث في الأسبوع العشرين للجنين؟
كثرة الوقوف قد تتسبب في تقليل تدفق الدم إلى الجنين وإبطاء نموه,هل الوقوف يؤثر على الحامل في الشهر الخامس؟
"
تعد هذه الوضعية خطيرة، لأنها تتحمل الوزن الكامل للرحم الذي ينمو باستمرار. ويمكن أن يؤدي النوم على ظهرك خلال النصف الثاني من الحمل إلى حدوث آلام في الظهر ومشاكل في التنفس وعسر الهضم والبواسير، فضلا عن انخفاض الدورة الدموية لقلبك وكذلك للجنين.",هل النوم على الظهر يؤثر على الجنين في الشهر الخامس؟
"الضغط الواقع على العصب الوركي خلال فترة الحمل، يزداد حجم الرحم ويزداد الضغط الواقع منه على المنطقة السفلية من الورك، التي تحتوي على العصب الوركي الممتد من أسفل الظهر إلى القدمين. وهذا بدوره يؤدي إلى زيادة الشعور بخدر وتنميل في المنطقة، إضافةً إلى ظهور ألم الورك أثناء الحمل.",ما سبب الم الرجلين للحامل في الشهر الخامس؟
"ضيق التنفس مع زيادة ضربات القلب. نزيف الأنف أو نزيف اللثة. حرقة بالمعدة. دوخة، وشعور بالإرهاق والتعب.",ما هي مخاطر الحمل في الشهر الخامس؟
"
يبقى الجنين بالحركة البسيطة وبعد ذلك تبدأ الحركة في الزيادة حتى تصل إلى 200 حركة في اليوم. ثم بعد ذلك تزداد حتى تصل إلى 570 حركة، ثم تنخفض بعد ذلك عندما يبدأ الجنين في النمو. الجنين ينام لمدة عشر دقائق، ومن الممكن أن تصل إلى نصف ساعة ثم يستيقظ بعد ذلك.",كم مرة يجب ان يتحرك الجنين في الشهر الخامس؟
"
يمكنك التقلب كما تشائين او النوم بالوضعيه التي تريحك, ولكن تنصح المرأه الحامل بالاشهر الاخيره بالنوم على جنبها ويفضل الجنب الايسر حيث يقل الضغط على الوريد الأجوف السفلى الذى ينقل الدم من الجزء السفلى من الجسم إلى القلب وبالتالي هذا يقلل من حدوث هبوط بضغط الام وكذلك يحسن تدفق الدم الى المشيمه",هل التقلب اثناء النوم يضر الجنين في الشهر الخامس؟
"كثرة حركة الجنين خاصة في الثلث الأخير من الحمل تدل على الصحة الجيدة للجنين، على الرغم من أن كثرة حركة الجنين قد تكون غير مريحة للأم خاصة عند النوم.",كثرة الحركة عند الجنين على ماذا تدل في الشهر الخامس؟
يمكن الاطمئنان على صحة الجنين بمراجعة الطبيب وإجراء الفحوصات السريرية والمخبرية اللازمة,كيف اتأكد من ان جنيني بخير؟
إن الحمل ونمو الجنين في رحم الأم ليس بالأمر السهل ويتسبب بالكثير من التعب والإرهاق والنعاس للحامل خاصة في الثلث الأول من الحمل الذي يمتد من الشهر الأول للحمل وحتى الشهر الثالث,هل طبيعي النوم بكثره في الشهر الخامس من الحمل؟
أن المشي يساعدك على الحفاظ على اللياقة والوزن المناسب أثناء الحمل ويقوي القلب بوجه عام .,هل المشي مفيد في الشهر الخامس؟
"آلام الظهر خلال فترة الحمل مشكلة معتادة، وهذا أمر طبيعي. حيث إن زيادة الوزن وتغيير مركز الجاذبية والهرمونات تعمل على إرخاء الأربطة الموجودة في مفاصل حوضك. ",هل الم الظهر امر طبيعي في الشهر الخامس؟
"قد تعني الانقباضات المنتظمة أن عضلات الرحم تتقلص، وتسمى انقباضات براكستون هيكس (بالإنجليزية: Braxton Hicks) وكذلك يطلق عليها الولادة الكاذبة، وتبدو وكأنها شد في البطن.",ما هي انقباضات الرحم في الشهر الخامس؟
"تجنُّب المشروبات الغازيّة وتلك التي تحتوي على الكافيين. تجنُّب البيض واللحم غير المطهوّ جيدًا. تجنُّب استهلاك بعض أنواع الأسماك لِما تحتويه من نسبة عالية من الزئبق يمكن أن تؤثّر سلبًا في صحة الجنين وقد تُسبّب تلف الدماغ لديه، يمكن تناول التونا والسلمون والابتعاد عن سمك أبو سيف، سمك الإسقمري وسمك القرميد أثناء الحمل.",ما يجب تجنبه في الشهر الخامس من الحمل؟
"هناك العديد من الأسباب التي تجعل السيدات الحوامل لا يتمكن من الشعور بحركة الجنين خلال الشهر الخامس، وأهم هذه الأسباب: وضع المشيمة حيث أن المشيمة في الشهر الخامس، تكون على السطح العلوي للرحم. ربما يكون وزن الأم في الشهر الخامس، هو السبب في قلة حركة الجنين.",ما هو سبب قلة حركة الجنين في الشهر الخامس؟
أنه من أفضل الطرق التي يمكن الاستعانة بها في رفع الجنين هي وضعية السجود. علاوة على ذلك فإنه يجب على الحامل التي تعاني من حالة نزول الجنين في الشهر الخامس النوم على الجانب الأيسر. حيث تساعد تلك الوضعية على زيادة تدفق الدم والأكسجين ورجوع الجنين إلى المشيمة.,ماذا افعل حتى يعدل الجنين وضعيته في الشهر الخامس؟
"ركلات حركة الجنين في هذه المرحلة قد تشبه رفرفة الفراشة أو موجات حركة السمكة الصغيرة أو كفقاعات هوائية. وبالعموم، تشعر غالبية الحوامل بحركة الجنين لأول مرة في الشهر الخامس.",ماذا تشبه حركات الجنين في الشهر الخامس؟
يصل طول الجنين من رأسه الى ردفيه (الطول التاجي المقعدي) حوالي 13 سم. يصبح للجنين بصمة أصابع فريدة ومكتملة النمو. يبدأ شعر رأس الجنين بالنمو. تستمر حاسة السمع لدى الجنين بالتطور.,ما هو شكل الجنين في الشهر الخامس؟
"من اسباب تحجر البطن في الشهر الخامس هو تعرض المرأة لانقباضات براكستون هيكس (بالإنجليزية: Braxton-hicks contraction) والتي تأتي على شكل شد بالبطن بسبب حدوث تقلصات في الرحم، لكنها لا تعتبر علامة على بدء المخاض ولا تسببه.",الم البطن في الشهر الخامس هل هو طبيعي؟
"
تشعر المرأة في حملها الأول بركلات الجنين في الأسبوع 20، وتشعر بها في حملها الثاني أو الثالث في الأسبوع 16؛ وقد يرجع ذلك إلى أن الأم في حملها الأول ربما تعتقد أن حركة الجنين هي اضطرابات في المعدة أو غازات، وتستغرق بعض الوقت للتعرف على ركلات طفلها، كما أن المرأة النحيفة تشعر بتلك الركلات بسهولة أكثر.",متى تبدأ حركة الجنين في الرحم؟
"ضيق التنفس مع زيادة ضربات القلب.
نزيف الأنف أو نزيف اللثة.
حرقة بالمعدة.
دوخة، وشعور بالإرهاق والتعب.
تورم القدمين مع احتمال ظهور الدوالي.
الإمساك وصعوبة في الهضم.
صداع.
ألم الظهر.
كبر حجم الثديين.
زيادة ملحوظة بوزن الجسم.",ماهي مشاكل الشهر الخامس؟
